{
  "state": "verified",
  "verdict": "transaction reached verified",
  "envelope_result": {
    "status": "satisfied",
    "satisfied": [
      "require[0] fact='ad.gPCMachineExtensionNames'",
      "require[1] fact='filedigest.gpttmpl.sha256'",
      "require[2] fact='gpttmpl.present'",
      "require[3] fact='scope.sysvol_relpaths'",
      "derive[0]",
      "derive[1]",
      "derive[2]",
      "derive[3]",
      "derive[4]",
      "derive[5]",
      "forbid[0] scope='ad.gPCMachineExtensionNames'",
      "forbid[1] scope='scope.sysvol_contained'",
      "forbid[2] scope='scope.policies.gpc_guids'"
    ],
    "violated": [],
    "unresolved": [],
    "unclassified": [],
    "characterization": "satisfied: 13 clause(s) held; 15 delta entries all covered; covered changed: filedigest.gpttmpl.bytes (category 'content'); covered changed: filedigest.gpttmpl.present (category 'content'); covered changed: filedigest.gpttmpl.sha256 (category 'content'); covered changed: gpttmpl.present (category 'content'); covered changed: scope.sysvol_relpaths (category 'structural'); covered added: gpttmpl.encoding.bom (category 'unclassified'); covered added: gpttmpl.encoding.cr_count (category 'unclassified'); covered",
    "delta": [
      {
        "key": "filedigest.gpttmpl.bytes",
        "kind": "changed",
        "before": null,
        "after": 142
      },
      {
        "key": "filedigest.gpttmpl.present",
        "kind": "changed",
        "before": false,
        "after": true
      },
      {
        "key": "filedigest.gpttmpl.sha256",
        "kind": "changed",
        "before": null,
        "after": "07cba636ed9c1c30c4a4c228e555151f1fc43f7bfc941cbb221ed67297ea3dbc"
      },
      {
        "key": "gpttmpl.present",
        "kind": "changed",
        "before": false,
        "after": true
      },
      {
        "key": "scope.sysvol_relpaths",
        "kind": "changed",
        "before": [
          "GPO.cmt",
          "Machine",
          "Machine/registry.pol",
          "User",
          "gpt.ini"
        ],
        "after": [
          "GPO.cmt",
          "Machine",
          "Machine/Microsoft",
          "Machine/Microsoft/Windows NT",
          "Machine/Microsoft/Windows NT/SecEdit",
          "Machine/Microsoft/Windows NT/SecEdit/GptTmpl.inf",
          "Machine/Scripts",
          "Machine/Scripts/Shutdown",
          "Machine/Scripts/Startup",
          "Machine/registry.pol",
          "User",
          "gpt.ini"
        ]
      },
      {
        "key": "gpttmpl.encoding.bom",
        "kind": "added",
        "before": "<missing>",
        "after": "utf16le"
      },
      {
        "key": "gpttmpl.encoding.cr_count",
        "kind": "added",
        "before": "<missing>",
        "after": 5
      },
      {
        "key": "gpttmpl.encoding.crlf_only",
        "kind": "added",
        "before": "<missing>",
        "after": true
      },
      {
        "key": "gpttmpl.encoding.lf_count",
        "kind": "added",
        "before": "<missing>",
        "after": 5
      },
      {
        "key": "gpttmpl.sections.0.key_value_shape",
        "kind": "added",
        "before": "<missing>",
        "after": true
      },
      {
        "key": "gpttmpl.sections.0.line_count",
        "kind": "added",
        "before": "<missing>",
        "after": 1
      },
      {
        "key": "gpttmpl.sections.0.name",
        "kind": "added",
        "before": "<missing>",
        "after": "Unicode"
      },
      {
        "key": "gpttmpl.sections.1.key_value_shape",
        "kind": "added",
        "before": "<missing>",
        "after": true
      },
      {
        "key": "gpttmpl.sections.1.line_count",
        "kind": "added",
        "before": "<missing>",
        "after": 2
      },
      {
        "key": "gpttmpl.sections.1.name",
        "kind": "added",
        "before": "<missing>",
        "after": "Version"
      }
    ]
  },
  "events": [
    {
      "sequence": 1,
      "from_state": null,
      "to_state": "prepared",
      "reason": "capability gpmc.observe_imported_firewall_rules prepared over GPO 959e824e-583c-486e-9d49-be1773e60d5d"
    },
    {
      "sequence": 2,
      "from_state": "prepared",
      "to_state": "armed",
      "reason": "capability gpmc.observe_imported_firewall_rules invocation started"
    },
    {
      "sequence": 3,
      "from_state": "armed",
      "to_state": "commit_attempted",
      "reason": "run-sheet crosses 'navigate_security_settings' (profile class 'potentially_mutating')"
    },
    {
      "sequence": 4,
      "from_state": "commit_attempted",
      "to_state": "verified",
      "reason": "converged after 2 polls, 2 reproductions"
    }
  ],
  "provenance": {
    "$schema": "docs/transaction-record-schema-v3.json",
    "schema_version": 3,
    "capability": "gpmc.observe_imported_firewall_rules",
    "run_sheet": "gpmc.observe_imported_firewall_rules",
    "transaction_id": "415d4eb5-466c-44d1-97bd-1f6c53c4cea1",
    "console": {
      "mode": "controller_direct",
      "state": "unlocked",
      "helper_responds": true
    },
    "steps": [
      [
        {
          "index": 0,
          "step": "wait_foreground[open_gpo_editor]",
          "ok": true,
          "detail": {
            "matched": true,
            "title": "Local Group Policy Editor",
            "surfaced": true
          }
        },
        {
          "index": 1,
          "step": "context[navigate_tree]",
          "ok": true,
          "detail": {
            "foreground": {
              "class": "ConsoleWindowClass",
              "process_name": "powershell",
              "pid": 2120,
              "uia_digest": "9193a3dfa818177116222e6726568faf1e459eb031086f91eface84216a650ea",
              "rect": {
                "left": 0,
                "bottom": 720,
                "top": 0,
                "right": 1024,
                "height": 720,
                "width": 1024
              },
              "title": "Administrator: C:\\WINDOWS\\System32\\WindowsPowerShell\\v1.0\\powershell.exe",
              "hwnd": 917636
            },
            "asserted_window": "Local Group Policy Editor"
          }
        },
        {
          "index": 2,
          "step": "click_element[navigate_tree]",
          "ok": true,
          "detail": {
            "clicked": [
              471,
              143
            ]
          }
        },
        {
          "index": 3,
          "step": "click_element[navigate_tree]",
          "ok": true,
          "detail": {
            "matched": false,
            "soft": true
          }
        },
        {
          "index": 4,
          "step": "click_element[navigate_tree]",
          "ok": true,
          "detail": {
            "clicked": [
              471,
              162
            ]
          }
        },
        {
          "index": 5,
          "step": "click_element[navigate_security_settings]",
          "ok": true,
          "detail": {
            "clicked": [
              471,
              181
            ]
          }
        },
        {
          "index": 6,
          "step": "click_element[navigate_firewall_rules]",
          "ok": true,
          "detail": {
            "clicked": [
              429,
              270
            ]
          }
        },
        {
          "index": 7,
          "step": "keys[navigate_firewall_rules] Tab into the scope tree (the firewall node is selected), expand it, step to the LDAP-named policy node",
          "ok": true,
          "detail": {
            "injected_events": 6
          }
        },
        {
          "index": 8,
          "step": "wait_element[navigate_firewall_rules]",
          "ok": true,
          "detail": {
            "matched": true,
            "attempts": 1,
            "waited_s": 8.8,
            "name": "Inbound Rules"
          }
        },
        {
          "index": 9,
          "step": "dump[navigate_firewall_rules]",
          "ok": true,
          "detail": {
            "elements": 71,
            "hwnd": 1048664,
            "names": [
              "Local Group Policy Editor",
              "zz-studio-evidence-plan035-wp2-w22 [LabDC01.ad.labdomain.dev] Policy\\Computer Configuration\\Windows Settings\\Security Settings\\Windows Defender Firewall with Advanced Security\\Windows Defender Firewall with Advanced Security - LDAP://CN={959E824E-583C-486E-9D49-BE1773E60D5D},CN=POLICIES,CN=SYSTEM,DC=AD,DC=LABDOMAIN,DC=DEV",
              "Console Embedded Window",
              "Windows Defender Firewall with Advanced Security provides network security for Windows computers.",
              "Overview",
              "5",
              "[Outbound connections status]",
              "Windows Defender Firewall state is not configured.",
              "Public Profile",
              "Domain Profile",
              "Default behavior for outbound connections is not configured.",
              "Windows Defender Firewall is on.",
              "Inbound connections that do not match a rule are blocked.",
              "Outbound connections that do not match a rule are allowed.",
              "Default behavior for outbound connections is not configured.",
              "Inbound connections that do not match a rule are blocked.",
              "Windows Defender Firewall is on.",
              "Private Profile",
              "Private Profile",
              "Windows Defender Firewall Properties",
              "Getting Started",
              "5",
              "Authenticate communications between computers",
              "Create connection security rules to specify how and when connections between computers are authenticated and protected by using Internet Protocol security (IPsec).",
              "Connection Security Rules",
              "Connection Security Rules",
              "View and create firewall rules",
              "Outbound Rules",